{
  "$schema": "https://json-schema.org/draft/2020-12/schema",
  "$id": "https://local.schemas.maple-automation.local/evidence-report.schema.json",
  "title": "Maple Automation Core Evidence Report",
  "description": "Machine-readable report metadata. A pending or not-run report records gate state and does not claim that the activity passed.",
  "type": "object",
  "$defs": {
    "version": {
      "type": "string",
      "pattern": "^\\d+\\.\\d+\\.\\d+$"
    },
    "sha256": {
      "type": "string",
      "pattern": "^[A-Fa-f0-9]{64}$"
    },
    "gitCommit": {
      "type": "string",
      "pattern": "^[A-Fa-f0-9]{40}$"
    },
    "id": {
      "type": "string",
      "pattern": "^[A-Za-z0-9][A-Za-z0-9._-]{2,128}$"
    },
    "timestamp": {
      "type": "string",
      "format": "date-time",
      "pattern": "^\\d{4}-\\d{2}-\\d{2}T\\d{2}:\\d{2}:\\d{2}(?:\\.\\d+)?(?:Z|[+-]\\d{2}:\\d{2})$"
    },
    "portablePath": {
      "type": "string",
      "minLength": 1,
      "pattern": "^(?!/)(?!.*:)(?!\\\\)(?!.*\\\\)(?!.*(?:^|/)\\.\\.?(?:/|$))(?!.*(?:^|/)[^/]*[. ](?:/|$)).+$"
    },
    "environment": {
      "type": "object",
      "required": [
        "runner_os",
        "python_version",
        "working_directory_policy"
      ],
      "properties": {
        "runner_os": {
          "type": "string",
          "minLength": 1
        },
        "python_version": {
          "type": "string",
          "pattern": "^\\d+\\.\\d+\\.\\d+$"
        },
        "workflow_name": {
          "type": "string",
          "minLength": 1
        },
        "run_id": {
          "type": "string",
          "pattern": "^[0-9]+$"
        },
        "run_attempt": {
          "type": "string",
          "pattern": "^[0-9]+$"
        },
        "working_directory_policy": {
          "type": "string",
          "enum": [
            "repository-relative",
            "external-roots-explicit"
          ]
        }
      },
      "additionalProperties": false
    },
    "check": {
      "type": "object",
      "required": [
        "name",
        "status",
        "command"
      ],
      "properties": {
        "name": {
          "type": "string",
          "minLength": 1
        },
        "status": {
          "type": "string",
          "enum": [
            "passed",
            "failed",
            "pending",
            "not-run",
            "skipped"
          ]
        },
        "command": {
          "type": "string",
          "minLength": 1
        },
        "duration_seconds": {
          "type": "number",
          "minimum": 0
        },
        "details": {
          "type": "object",
          "additionalProperties": true
        }
      },
      "additionalProperties": false
    },
    "artifact": {
      "type": "object",
      "required": [
        "artifact_id",
        "name",
        "kind",
        "path",
        "size_bytes",
        "sha256"
      ],
      "properties": {
        "artifact_id": {
          "$ref": "#/$defs/id"
        },
        "name": {
          "type": "string",
          "minLength": 1
        },
        "kind": {
          "type": "string",
          "enum": [
            "junit",
            "coverage",
            "wheel",
            "sdist",
            "manifest",
            "asset-index",
            "evidence-report",
            "dependency-lock",
            "other"
          ]
        },
        "path": {
          "$ref": "#/$defs/portablePath"
        },
        "size_bytes": {
          "type": "integer",
          "minimum": 0
        },
        "sha256": {
          "$ref": "#/$defs/sha256"
        },
        "retention_days": {
          "type": "integer",
          "minimum": 1
        },
        "upload_name": {
          "type": "string",
          "minLength": 1
        }
      },
      "additionalProperties": false
    }
  },
  "required": [
    "schema_version",
    "evidence_id",
    "report_kind",
    "status",
    "bundle_id",
    "release_id",
    "source_commit",
    "execution_mode",
    "subject_id",
    "environment",
    "checks",
    "generated_at"
  ],
  "properties": {
    "schema_version": {
      "$ref": "#/$defs/version"
    },
    "evidence_id": {
      "$ref": "#/$defs/id"
    },
    "report_kind": {
      "type": "string",
      "enum": [
        "test",
        "replay",
        "shadow",
        "clean-smoke",
        "build",
        "dependency",
        "manifest",
        "hash",
        "ci"
      ]
    },
    "status": {
      "type": "string",
      "enum": [
        "passed",
        "failed",
        "pending",
        "not-run",
        "skipped"
      ]
    },
    "bundle_id": {
      "$ref": "#/$defs/id"
    },
    "release_id": {
      "$ref": "#/$defs/id"
    },
    "source_commit": {
      "$ref": "#/$defs/gitCommit"
    },
    "execution_mode": {
      "type": "string",
      "enum": [
        "offline",
        "shadow",
        "dry-run",
        "canary",
        "live"
      ]
    },
    "subject_id": {
      "type": "string",
      "pattern": "^subject-[a-z0-9][a-z0-9._-]{1,64}$"
    },
    "environment": {
      "$ref": "#/$defs/environment"
    },
    "checks": {
      "type": "array",
      "minItems": 1,
      "items": {
        "$ref": "#/$defs/check"
      }
    },
    "artifacts": {
      "type": "array",
      "items": {
        "$ref": "#/$defs/artifact"
      }
    },
    "summary": {
      "type": "object",
      "additionalProperties": true
    },
    "generated_at": {
      "$ref": "#/$defs/timestamp"
    }
  },
  "additionalProperties": false
}
