{
  "artifacts": [
    {
      "artifact_id": "shadow-result-shadow-result",
      "kind": "evidence-report",
      "name": "shadow-result.json",
      "path": "evidence/g0-candidate-core-v2-20260829/raw/shadow-result.json",
      "sha256": "86bcadf29fc43c06ac75ffedbc4a2e3517caf58ce336dc6b4b6cef9aac0baedd",
      "size_bytes": 5456
    }
  ],
  "bundle_id": "candidate-core-v2-20260829-shadow",
  "checks": [
    {
      "command": "python tools/run_shadow.py --manifest <runtime-manifest> --report <shadow-result>",
      "details": {
        "diff_count": 2,
        "fixture_digest": "22dd58eeaee16cb72eea529f177aad86747e162e7d9e7458a284a0dad4e6eb34",
        "real_input_call_count": 0,
        "report_digest": "3b1e1f217ebf4b25ca6bed1dc0f92cf5a53cb1b7dc804c48a34ca8e085804118",
        "report_id": "shadow-golden-pilot-minimal-v1-candidate-core-v2-20260829-shadow",
        "runtime_manifest_sha256": "2e9835b52a8e3eef9c769e375ac1bd04ac5cc3a2c35272cc0ba6f6d814a0f315",
        "unclassified_diff_count": 0
      },
      "name": "shadow-runner",
      "status": "passed"
    }
  ],
  "environment": {
    "python_version": "3.13.13",
    "runner_os": "Windows",
    "working_directory_policy": "repository-relative"
  },
  "evidence_id": "shadow-report-g0-candidate-shadow-20260829",
  "execution_mode": "shadow",
  "generated_at": "2026-08-29T00:00:00Z",
  "release_id": "candidate-core-v2-20260829-shadow",
  "report_kind": "shadow",
  "schema_version": "1.0.0",
  "source_commit": "6fbb7ff000591dd39648c82fa46775419349cf26",
  "status": "passed",
  "subject_id": "subject-01",
  "summary": {
    "claim_scope": "Offline Shadow comparison only; no field claim.",
    "input_owner": "legacy",
    "real_input_enabled": false
  }
}
