{
  "artifacts": [],
  "bundle_id": "candidate-core-v2-20260829-shadow",
  "checks": [
    {
      "command": "python -m pytest --junitxml=<junit.xml> --cov=maple_automation_core",
      "details": {
        "reason": "JUnit XML was not supplied."
      },
      "name": "pytest",
      "status": "not-run"
    },
    {
      "command": "python -m coverage xml",
      "details": {
        "reason": "Coverage XML was not supplied."
      },
      "name": "coverage",
      "status": "not-run"
    }
  ],
  "environment": {
    "python_version": "3.13.13",
    "runner_os": "Windows",
    "working_directory_policy": "repository-relative"
  },
  "evidence_id": "test-report-g0-candidate-shadow-20260829",
  "execution_mode": "shadow",
  "generated_at": "2026-08-29T00:00:00Z",
  "release_id": "candidate-core-v2-20260829-shadow",
  "report_kind": "test",
  "schema_version": "1.0.0",
  "source_commit": "6fbb7ff000591dd39648c82fa46775419349cf26",
  "status": "not-run",
  "subject_id": "subject-01",
  "summary": {
    "claim_scope": "local quality evidence only; no field or input-control claim."
  }
}
