{
  "artifacts": [],
  "bundle_id": "candidate-core-v2-20260829-shadow",
  "checks": [
    {
      "command": "stream every configured asset byte through SHA-256 during generation",
      "details": {
        "asset_count": 10,
        "external_asset_count": 8,
        "measurement_stage": "generation"
      },
      "name": "asset-byte-sha256-measurement",
      "status": "passed"
    }
  ],
  "environment": {
    "python_version": "3.13.13",
    "runner_os": "Windows",
    "working_directory_policy": "repository-relative"
  },
  "evidence_id": "hash-report-g0-candidate-shadow-20260829",
  "execution_mode": "shadow",
  "generated_at": "2026-08-29T00:00:00Z",
  "release_id": "candidate-core-v2-20260829-shadow",
  "report_kind": "hash",
  "schema_version": "1.0.0",
  "source_commit": "190e3d49870485f8ea59cddbfa433e349103cdff",
  "status": "passed",
  "subject_id": "subject-01",
  "summary": {
    "claim_scope": "Hashes were measured from the configured external roots at generation time."
  }
}
