{
  "artifacts": [
    {
      "artifact_id": "replay-result-golden-replay-result",
      "kind": "evidence-report",
      "name": "golden-replay-result.json",
      "path": "evidence/g0-candidate-core-v2-20260829/raw/golden-replay-result.json",
      "sha256": "843907391642e46dff4eae70829fd4c63b725301c078ace19737cb1bafbf1f98",
      "size_bytes": 4789
    }
  ],
  "bundle_id": "candidate-core-v2-20260829-shadow",
  "checks": [
    {
      "command": "python tools/run_golden_replay.py --runs 3 --manifest <runtime-manifest> --report <replay-result>",
      "details": {
        "deterministic": true,
        "fixture_digest": "22dd58eeaee16cb72eea529f177aad86747e162e7d9e7458a284a0dad4e6eb34",
        "repeat_count": 3,
        "report_digest": "a2648a6284a8b544ef6438a697e0aa3e1e9778e0b68ab08b2376ac63fbf03286",
        "report_id": "replay-golden-pilot-minimal-v1-candidate-core-v2-20260829-shadow",
        "runtime_manifest_sha256": "5d545496f9b9b8de9302eb2a2b83eb85204a55ca3cff7147940a75e888044f17"
      },
      "name": "deterministic-replay",
      "status": "passed"
    }
  ],
  "environment": {
    "python_version": "3.13.13",
    "runner_os": "Windows",
    "working_directory_policy": "repository-relative"
  },
  "evidence_id": "replay-report-g0-candidate-shadow-20260829",
  "execution_mode": "shadow",
  "generated_at": "2026-08-29T00:00:00Z",
  "release_id": "candidate-core-v2-20260829-shadow",
  "report_kind": "replay",
  "schema_version": "1.0.0",
  "source_commit": "c5679a01394df5f7e2f61b3b2bd2cfdcdb2444a6",
  "status": "passed",
  "subject_id": "subject-01",
  "summary": {
    "claim_scope": "Deterministic offline Replay only; no field claim."
  }
}
